{
  "$schema": "https://json-schema.org/draft/2020-12/schema",
  "$id": "https://bstbizera.github.io/biztrust_guide/schemas/current-state.schema.json",
  "title": "badf/current-state.json",
  "$comment": "Schema version 1.0.0. Derived from the record as it stood at main 6ba41e5 (WP-043) under BIZTRUST-GUIDE-WP-044; describes, does not prescribe. Closed enums only where AGENTS.md already closes them: state (section 8) and resume_decision (section 3).",
  "type": "object",
  "additionalProperties": false,
  "required": [
    "schema_version", "project_id", "repository", "updated_at", "active_work_package", "source",
    "gates", "authority", "latest_checkpoint", "latest_handoff", "primary_next_action_id",
    "resume_decision", "stop_reason", "known_divergence"
  ],
  "properties": {
    "schema_version": { "type": "string", "pattern": "^[0-9]+\\.[0-9]+\\.[0-9]+$" },
    "project_id": { "type": "string", "minLength": 1 },
    "repository": { "type": "string", "pattern": "^[A-Za-z0-9-]+/[A-Za-z0-9._-]+$" },
    "updated_at": { "type": "string", "format": "date-time" },
    "active_work_package": {
      "type": "object",
      "additionalProperties": false,
      "required": ["id", "title", "state", "objective", "issue_url", "owner_role", "scope"],
      "properties": {
        "id": { "type": "string", "pattern": "^BIZTRUST-GUIDE-WP-[0-9]{3}$" },
        "title": { "type": "string", "minLength": 1 },
        "state": { "enum": ["DRAFT", "READY", "AUTHORIZED", "IN_PROGRESS", "VALIDATING", "ENGINEERING_READY", "ACCEPTED", "CLOSED", "BLOCKED", "WAIT_FOR_AUTHORITY", "RECOVERY_REQUIRED", "REJECTED", "CANCELLED"] },
        "objective": { "type": "string", "minLength": 1 },
        "issue_url": { "type": "string", "pattern": "^https://github\\.com/[^/\\s]+/[^/\\s]+/(issues|pull)/[0-9]+$" },
        "owner_role": { "type": "string", "minLength": 1 },
        "scope": { "type": "array", "minItems": 1, "items": { "type": "string", "minLength": 1 } }
      }
    },
    "source": {
      "type": "object",
      "additionalProperties": false,
      "required": ["branch", "baseline_commit", "baseline_kind", "expected_remote"],
      "properties": {
        "branch": { "type": "string", "minLength": 1 },
        "baseline_commit": { "type": "string", "pattern": "^[0-9a-f]{40}$" },
        "baseline_kind": { "type": "string", "minLength": 1 },
        "expected_remote": { "type": "string", "pattern": "^https://[^\\s]+$" }
      }
    },
    "gates": { "type": "object", "minProperties": 1, "additionalProperties": { "type": "string", "minLength": 1 } },
    "authority": { "type": "object", "minProperties": 1, "additionalProperties": { "type": "string", "minLength": 1 } },
    "latest_checkpoint": { "type": "string", "pattern": "^sessions/checkpoints/[^/\\s]+\\.json$" },
    "latest_handoff": { "type": ["string", "null"] },
    "primary_next_action_id": { "type": "string", "pattern": "^NS-[0-9]{3}$" },
    "resume_decision": { "enum": ["CONTINUE", "BLOCKED", "WAIT_FOR_AUTHORITY", "RECOVERY_REQUIRED", "COMPLETE"] },
    "stop_reason": { "type": "string", "minLength": 1 },
    "known_divergence": { "type": "string" }
  }
}
