{
  "schema_version": "1.0.0",
  "project_id": "BIZTRUST-GUIDE",
  "repository": "bstBizEra/biztrust_guide",
  "updated_at": "2026-09-06T04:31:36Z",
  "active_work_package": {
    "id": "BIZTRUST-GUIDE-WP-062",
    "title": "The hub's next-steps cards carry docs/NEXT_STEPS.md's frozen labels, held by a test - issue #214",
    "state": "ENGINEERING_READY",
    "objective": "Resolve ticket #208 on the Guide v2 map: decide that docs/NEXT_STEPS.md's frozen labels are the numbering the hub's next-steps cards carry; renumber the hub's three platform cards to NS-010, NS-011 and NS-012 and title every card as the file's heading; align NEXT_STEPS's NS-012 heading to PLAN-001's P1A with its id unchanged; say on the hub and in the file that the live ledger is badf/next-actions.json and is never resolved against the cards; hold the cards to the headings with a test.",
    "issue_url": "https://github.com/bstBizEra/biztrust_guide/issues/214",
    "owner_role": "documentation-engineer",
    "scope": [
      "index.html",
      "docs/NEXT_STEPS.md",
      "tests/test_hub_next_steps_match_roadmap.py",
      "README.md",
      "badf/current-state.json",
      "badf/next-actions.json",
      "badf/decision-log.jsonl",
      "sessions/checkpoints/BIZTRUST-GUIDE-WP-062-engineering-ready.json"
    ]
  },
  "source": {
    "branch": "docs/biztrust-guide-wp-062-hub-ns-labels",
    "baseline_commit": "ebdc50c09ca0a96a31aa340b7d5c0572a5beb9be",
    "baseline_kind": "main",
    "expected_remote": "https://github.com/bstBizEra/biztrust_guide"
  },
  "gates": {
    "content": "NINE_STAGES_FIVE_PHASES_TWO_REFERENCE_PAGES_PUBLISHED",
    "continuity": "PASS",
    "security": "PASS_WITH_LOCAL_PREVIEW_LIMITATION",
    "deployment": "PUBLISHED_AND_SERVING"
  },
  "authority": {
    "implementation": "GRANTED_BY_USER_REQUEST_2026_09_03",
    "repository_publish": "GRANTED_VIA_PULL_REQUEST",
    "github_pages_activation": "REQUIRES_REPOSITORY_ADMIN",
    "resume_decision_taxonomy": "DECIDED_2026_09_04_OPTION_B_NOT_SCORED",
    "experiment_rerun": "NOT_GRANTED_PENDING_INDEPENDENT_ORACLE_AUTHOR",
    "production_platform_implementation": "NOT_GRANTED",
    "architecture_acceptance": "NOT_GRANTED",
    "architecture_drafting_ahead_of_s01": "WAIT_FOR_OPERATOR_WAIVER_ISSUE_92",
    "wayfinder_charting": "OPERATOR_INSTRUCTION_ON_YOUR_CALL_2026_09_05",
    "p0_design_pack_drafting": "OPERATOR_INSTRUCTION_2026_09_05_PROCEED_ON_YOUR_CALL_PROPOSED_ONLY",
    "guide_v2_records_drafting": "OPERATOR_INSTRUCTION_2026_09_06_PROCEED_PROPOSED_ONLY"
  },
  "latest_checkpoint": "sessions/checkpoints/BIZTRUST-GUIDE-WP-062-engineering-ready.json",
  "latest_handoff": null,
  "primary_next_action_id": "NS-041",
  "resume_decision": "WAIT_FOR_AUTHORITY",
  "stop_reason": "WP-062 is done on this branch and awaits merge after review, as for WP-029 through WP-061. The hub's next-steps cards carry docs/NEXT_STEPS.md's frozen labels, NS-001 to NS-004 and NS-010 to NS-012, titled as its headings and held to them by tests/test_hub_next_steps_match_roadmap.py; the hub no longer carries an NS-005, NS-006 or NS-007 card, so the file's NS-007, the issue-branch-PR binding, is the only NS-007 among the hub and the file (the ledger issued its own NS-007 historically, as the file's header says) and remains the next unticketed engineering item. The live ledger stays badf/next-actions.json with its own counter. The primary action is unchanged: NS-041, the operator's #92 waiver on #27. NS-044 points at #211. Unchanged: NS-040 (#78), NS-024 (#93), NS-042 (#94), NS-043 (#147 on map #128), NS-033 (#52), NS-003 to NS-005 of docs/NEXT_STEPS.md for the repository owner, the oracle author, experiment re-run NOT_GRANTED; #154 asks the operator for the roadmap's three cited documents.",
  "known_divergence": "The sixth instance of stale operational state (PR #56, which applied items 2 and 3 against this repository's own recorded ordering) is closed: #57 reverted it, and the fixtures are byte-identical to the sealed set at e37fa3b. A seventh opened at 2026-09-04T06:46:45Z and is closed by this commit: the human decision was recorded on issue #52, and until now this file still read resume_decision WAIT_FOR_AUTHORITY with a stop_reason naming the question that decision answers, while NS-031 - whose evidence requirement the decision had already met - remained the primary action. The interval was under four minutes because the decision record named the gap itself. That is not a fix for the underlying defect: state still reconciles by hand, and the proposal that would retire hand-maintenance remains PROPOSED on a failed instrument. WP-030 is stacked on WP-029's unmerged branch so that both can update this file without a merge conflict; if PR #58 merges with its branch deleted, GitHub retargets WP-030 to main. Until both merge, main's copy of this file still names WP-029 - that is the ordinary lag of a stacked change, not an eighth instance, because the record here says so. WP-030 merged as PR #64 after its stacked PR #60 was closed by the deletion of its base branch; the stacking rationale in DEC-028 (7) was wrong and is corrected by DEC-029 and this note - stack nothing on a branch that will be deleted. WP-031 merged as PR #65 at 28898879bef6, and the github-pages environment recorded a successful deployment of that head at 2026-09-04T15:46:34Z (deployment 6267852711). The README paragraph that said Pages was blocked and the site returned 404 was committed at 2026-09-03T12:56:32Z, five minutes after the first successful deployment (6244308440, success at 12:51:36Z), and stood until WP-032 - false when written, not merely outlived. It is replaced by pointers rather than by a fresher sentence; a fresher sentence would be the eighth instance waiting to happen. WP-032 merged as PR #67; the site's serving commit is read from the deployments API, not asserted here. WP-033 merged as PR #69 at 0b564b6. The WP-034 branch replaces the pre-dated deployment claims in LIVE_PREVIEW.md, NEXT_STEPS.md and AGENT_CONTINUITY.md by pointer and by dated correction, not by a fresher sentence. One correction to the WP-032 sentence above: the README paragraph and the runbook line were authored on 2026-09-02 while still true (cc40f0f), and merged to main five minutes after the first deployment succeeded - 'false when written' overstated it; they were false when merged and stood for a day. WP-034 merged as PR #70. From WP-035 on, a checkpoint that does not match its schema fails the test suite; the three that predate enforcement are registered by name and may only leave the registry. WP-036 is open as PR #74, held on the issue #52 answer, and registers NS-037 and DEC-038 on its own branch; this package branched from main without it, so whichever of the two merges second must merge badf/ against the other - DEC numbers, NS-033's wording and the decision-log order included. The spine registry emptied under WP-037. WP-037 merged as PR #75 at 7df92b6. The live badf hazard is now PR #74 (WP-036, held) against this package: #74 carries DEC-038 and NS-037, this carries DEC-040, NS-039 and NS-040; whichever lands second merges badf/ against the other. WP-038 merged as PR #79 at 0bbcda9. Against PR #74 the hazard on this branch is: #74 carries DEC-038 and NS-037 with NS-033 primary; this carries DEC-041, retires NS-039 and makes NS-040 primary with WAIT_FOR_AUTHORITY - whichever lands second must also reconcile the primary action and the resume decision. WP-039 merged as PR #80 at 0eab782. The hub and plan.html said nothing validates a checkpoint against its schema for under two hours after WP-035 made that false; corrected under WP-040 with the package named rather than a date, since the sentence is about a mechanism and not a status. WP-040 merged as PR #82 at 6a88463 and was verified serving byte-identical to that commit at 19:22:58Z (WP-041). WP-042 merged as PR #86 at 00e11c5. WP-043 merged as PR #88 at 6ba41e5. WP-044 merged as PR #90 at e1b20d1. On 2026-09-05, with more than ten interactive agent sessions open on the main checkout (a ListAgents count at the time, not verifiable from the repository), a peer session committed this package's then-uncommitted AGENTS.md edit to local main with the literal message $(cat <<'EOF' (by inference from the message shape, a bash heredoc passed through PowerShell); it was never pushed, and under WP-045 local main was rebased onto origin/main and the commit dropped, keeping the edit. The same day two research agents left downloaded README copies and empty redirect-named files in the checkout root; all removed. Neither is an instance of stale operational state; both are recorded because the checkout is shared and the next reader should expect it. WP-045 merged as PR #127 at e5398c9. The P0 recap document the operator supplied on 2026-09-05 was checked against DELIVERY_PLAN.md and phases/ before the design map was charted: twelve, thirteen, ten and eleven epics, five phase pages, seven gates; no divergence. WP-046 merged as PR #150 at 8bcac2e. The landing page carries a dated reading of this file's authority keys; if architecture_acceptance or production_platform_implementation changes here and the page's strip does not, that is the page diverging from its source and is corrected in the same package as the change. WP-047 merged as PR #152 at eb8e745. From WP-048 two plan documents coexist on purpose: DELIVERY_PLAN.md v0.1, which phases/ renders and the phase-page test enforces, and BIZTRUST-PLAN-001.md v1.0-draft, the partition the manuals are moving to; the v0.1 header names the supersession and the tickets that retire it, so a reader meeting either file is told which is which. That is a declared transition, not an instance of stale operational state; it becomes one only if a manual moves without the test moving, or v0.1 outlives the last manual. WP-048 merged as PR #182 at 8992a7d. From WP-049 the declared transition covers the gate table as well as the partition: DELIVERY_PLAN.md section